# 2012 April 02
#
# The author disclaims copyright to this source code.  In place of
# a legal notice, here is a blessing:
#
#    May you do good and not evil.
#    May you find forgiveness for yourself and forgive others.
#    May you share freely, never taking more than you give.
#
#***********************************************************************
# The tests in this file were used while developing the SQLite 4 code. 
#
set testdir [file dirname $argv0]
source $testdir/tester.tcl
set testprefix simple

#set sqlite_where_trace 1

do_execsql_test 1.0 { 
  PRAGMA table_info = sqlite_master
} {
    0 type text        0 {} 0 
    1 name text        0 {} 0 
    2 tbl_name text    0 {} 0 
    3 rootpage integer 0 {} 0 
    4 sql text         0 {} 0 
}

do_execsql_test 1.1 { SELECT * FROM sqlite_master } {}

#explain { CREATE TABLE t1(a, b) }
#execsql { PRAGMA kv_trace = 1 }
#execsql { PRAGMA vdbe_trace = 1 }

do_execsql_test 1.2 { 
  CREATE TABLE t1(a, b);
  PRAGMA table_info = t1;
} {
    0 a {} 0 {} 0 
    1 b {} 0 {} 0 
}

do_execsql_test 1.3 { 
  CREATE TABLE t2(x, y);
  PRAGMA table_info = t2;
} {
    0 x {} 0 {} 0 
    1 y {} 0 {} 0 
}

do_execsql_test 1.4 { 
  CREATE TABLE t3(k PRIMARY KEY, v);
  PRAGMA table_info = t3;
} {
    0 k {} 0 {} 1 
    1 v {} 0 {} 0 
}

do_execsql_test 1.5 { 
  SELECT name, rootpage FROM sqlite_master 
} {t1 2 t2 3 t3 4}

#-------------------------------------------------------------------------
reset_db

do_execsql_test 2.1 { 
  CREATE TABLE t1(k PRIMARY KEY, v);
  CREATE TABLE t2(x, y); 
} {}

do_execsql_test 2.2.1 { INSERT INTO t1 VALUES('a', 'AAA') }
do_execsql_test 2.2.2 { SELECT * FROM t1 } {a AAA}
do_execsql_test 2.2.3 { INSERT INTO t1 VALUES('b', 'BBB') }
do_execsql_test 2.2.4 { SELECT * FROM t1 } {a AAA b BBB}

do_execsql_test 2.3.1 { INSERT INTO t2 VALUES('123', '456') }
do_execsql_test 2.3.2 { SELECT * FROM t2 } {123 456}
do_execsql_test 2.3.3 { INSERT INTO t2 VALUES('789', '0ab') }
do_execsql_test 2.3.4 { SELECT * FROM t2 } {123 456 789 0ab}

do_catchsql_test 2.2.5 {
  INSERT INTO t1 VALUES('a', 'CCC')
} {1 {column k is not unique}}

#-------------------------------------------------------------------------
reset_db

do_execsql_test 3.1 { CREATE TABLE t1(k PRIMARY KEY, v UNIQUE) }

do_execsql_test 3.2 { 
  SELECT * FROM sqlite_master
} {
  table t1                    t1 2 {CREATE TABLE t1(k PRIMARY KEY, v UNIQUE)} 
  index sqlite_autoindex_t1_2 t1 3 {}
}

#explain { INSERT INTO t1 VALUES('one', '111') }
#execsql { PRAGMA vdbe_trace = 1 }
#execsql { PRAGMA kv_trace = 1 }
#
do_execsql_test 3.3 { INSERT INTO t1 VALUES('one', '111') } {}


#-------------------------------------------------------------------------
reset_db

do_execsql_test 4.1 { CREATE TABLE t1(k PRIMARY KEY, v) }
do_execsql_test 4.2 { CREATE INDEX i1 ON t1(v) }

do_execsql_test 4.3 { 
  SELECT * FROM sqlite_master
} {
  table t1 t1 2 {CREATE TABLE t1(k PRIMARY KEY, v)} 
  index i1 t1 3 {CREATE INDEX i1 ON t1(v)}
}
do_execsql_test 4.4 { INSERT INTO t1 VALUES('one', '111') } {}
do_execsql_test 4.5 { SELECT * FROM t1 } {one 111} 

do_execsql_test 4.6 { PRAGMA integrity_check } {ok}


#-------------------------------------------------------------------------
reset_db

do_execsql_test 5.1 { CREATE TABLE t1(k, v UNIQUE) }
do_execsql_test 5.2 { CREATE INDEX i1 ON t1(v) }

do_execsql_test 5.3 { 
  SELECT * FROM sqlite_master
} {
  table t1                    t1 3 {CREATE TABLE t1(k, v UNIQUE)} 
  index sqlite_autoindex_t1_1 t1 2 {}
  index i1                    t1 4 {CREATE INDEX i1 ON t1(v)}
}

do_execsql_test 5.3 { INSERT INTO t1 VALUES('one', '111') } {}
do_execsql_test 5.4 { SELECT * FROM t1 } {one 111} 
do_execsql_test 5.5 { PRAGMA integrity_check } {ok}

#-------------------------------------------------------------------------
reset_db

do_execsql_test 6.1 { 
  CREATE TABLE t1(k PRIMARY KEY, v);
  CREATE INDEX i1 ON t1(v);
  INSERT INTO t1 VALUES('one', 1);
  INSERT INTO t1 VALUES('two', 2);
  INSERT INTO t1 VALUES('three', 3);
  INSERT INTO t1 VALUES('four', 4);
  INSERT INTO t1 VALUES('five', 5);
}

do_execsql_test 6.2 { 
  SELECT * FROM t1
} {five 5 four 4 one 1 three 3 two 2}

do_execsql_test 6.3 { 
  CREATE TABLE t2(x PRIMARY KEY, y);
  INSERT INTO t2 SELECT v, k FROM t1;
  SELECT * FROM t2
} {1 one 2 two 3 three 4 four 5 five}
do_execsql_test 6.4 { PRAGMA integrity_check } {ok}

do_execsql_test 6.5 { 
  CREATE TABLE t3(a, b);
  INSERT INTO t3 SELECT k, v FROM t1;
  SELECT * FROM t3
} {five 5 four 4 one 1 three 3 two 2}

do_execsql_test 6.6 { 
  INSERT INTO t3 SELECT a, b FROM t3;
  SELECT * FROM t3;
} {five 5 four 4 one 1 three 3 two 2 five 5 four 4 one 1 three 3 two 2}

do_execsql_test 6.7 { PRAGMA integrity_check } {ok}
do_execsql_test 6.8 { CREATE INDEX i2 ON t3(a) }
do_execsql_test 6.9 { PRAGMA integrity_check } {ok}

#-------------------------------------------------------------------------
reset_db

do_execsql_test 7.1 {
  CREATE TABLE t1(a, b);
  CREATE INDEX i1 ON t1(a);
}
do_execsql_test 7.2.1 { INSERT INTO t1 VALUES('xyz', '123') }
do_execsql_test 7.2.2 { INSERT INTO t1 VALUES('xyz', '123') }
do_execsql_test 7.2.3 { INSERT INTO t1 VALUES('xyz', '123') }

do_execsql_test 7.3 {
  SELECT * FROM t1;
} {xyz 123 xyz 123 xyz 123}

do_execsql_test 7.4 { PRAGMA integrity_check } {ok}

#-------------------------------------------------------------------------
reset_db

do_execsql_test 8.1 {
  CREATE TABLE t1(a PRIMARY KEY, b);
  INSERT INTO t1 VALUES('a', 'b');
}

do_execsql_test 8.2 { DELETE FROM t1 WHERE b = 'b' }
do_execsql_test 8.3 { SELECT * FROM t1 } {}

do_execsql_test 8.4 {
  INSERT INTO t1 VALUES('a', 'A');
  INSERT INTO t1 VALUES('b', 'B');
  INSERT INTO t1 VALUES('c', 'A');
  INSERT INTO t1 VALUES('d', 'B');
  INSERT INTO t1 VALUES('e', 'A');
  INSERT INTO t1 VALUES('f', 'B');
}
do_execsql_test 8.5 { DELETE FROM t1 WHERE b = 'B' }
do_execsql_test 8.6 { SELECT * FROM t1 } {a A c A e A}

#-------------------------------------------------------------------------
reset_db

do_execsql_test 9.1 {
  CREATE TABLE t1(a, b);
  CREATE INDEX i1 ON t1(b);
}

do_execsql_test 9.2 {
  INSERT INTO t1 VALUES('a', 'A');
  INSERT INTO t1 VALUES('b', 'B');
  INSERT INTO t1 VALUES('c', 'A');
  INSERT INTO t1 VALUES('d', 'B');
  INSERT INTO t1 VALUES('e', 'A');
  INSERT INTO t1 VALUES('f', 'B');
}
do_execsql_test 9.3 { DELETE FROM t1 WHERE +b = 'B' }
do_execsql_test 9.4 { SELECT * FROM t1 } {a A c A e A}
do_execsql_test 9.5 { PRAGMA integrity_check } {ok}

#-------------------------------------------------------------------------
reset_db

do_execsql_test 10.1 {
  CREATE TABLE t1(a, b);
  CREATE INDEX i1 ON t1(b);
}
do_execsql_test 10.2 {
  INSERT INTO t1 VALUES(1, 2);
  INSERT INTO t1 VALUES(3, 4);
}

do_execsql_test 10.3 { UPDATE t1 SET b = 10 WHERE a=3 }
do_execsql_test 10.4 { SELECT * FROM t1 } {1 2 3 10}
do_execsql_test 10.5 { PRAGMA integrity_check } {ok}

#-------------------------------------------------------------------------
reset_db

do_execsql_test 11.1 {
  CREATE TABLE t1(a, b, c, UNIQUE(a));
  INSERT INTO t1 VALUES(1,2,3);
}
do_catchsql_test 11.2 { 
  INSERT INTO t1 VALUES(1,2,4)
} {1 {column a is not unique}}

#-------------------------------------------------------------------------
reset_db

do_execsql_test 12.1 {
  CREATE TABLE t1(a, b);
  INSERT INTO t1 VALUES(3, 'three');
  INSERT INTO t1 VALUES(1, 'one');
  INSERT INTO t1 VALUES(2, 'two');
}
do_execsql_test 12.2 { SELECT * FROM t1 ORDER BY a } {1 one 2 two 3 three}
do_execsql_test 12.3 { SELECT * FROM t1 ORDER BY b } {1 one 3 three 2 two}

#-------------------------------------------------------------------------
reset_db

do_execsql_test 13.1 {
  CREATE TABLE t1(a, b);
  INSERT INTO t1 VALUES(3, 'three');
  INSERT INTO t1 VALUES(1, 'one');
  INSERT INTO t1 VALUES(2, 'two');
}
do_execsql_test 13.2  { SELECT a FROM t1 } {3 1 2}
do_execsql_test 13.3  { CREATE TABLE t2(x, y) }
do_execsql_test 13.4  { SELECT a FROM t1 } {3 1 2}
do_execsql_test 13.5  { DROP TABLE t2 }
do_execsql_test 13.6  { SELECT a FROM t1 } {3 1 2}
do_execsql_test 13.7  { CREATE TABLE t2 AS SELECT * FROM t1 }
do_execsql_test 13.8  { SELECT a FROM t2 } {3 1 2}
do_execsql_test 13.9  { DROP TABLE t1 }
do_execsql_test 13.10 { SELECT a FROM t2 } {3 1 2}

#-------------------------------------------------------------------------
reset_db

do_execsql_test 14.1 {
  CREATE TABLE t1(a,b,c NOT NULL  DEFAULT 5);
  CREATE TABLE t2(a,b,c); 
  CREATE TABLE t3(x);

  INSERT INTO t2 VALUES(1,2,1);
  INSERT INTO t2 VALUES(2,3,2);
  INSERT INTO t2 VALUES(3,4,1);
  INSERT INTO t2 VALUES(4,5,4);

  INSERT INTO t3 VALUES(1);
}

do_execsql_test 14.2 { DROP TABLE t1 }
do_execsql_test 14.3 { SELECT * FROM t3 } 1

#-------------------------------------------------------------------------
reset_db

do_execsql_test 15.1.1 { CREATE TABLE t1(x PRIMARY KEY) }
do_execsql_test 15.1.2 { 
  BEGIN;
    INSERT INTO t1 VALUES('rollback is not implemented yet');
}
do_execsql_test 15.1.3 { ROLLBACK }
do_execsql_test 15.1.4 { SELECT * FROM t1 } {}

#-------------------------------------------------------------------------
reset_db

do_execsql_test 16.1.1 {
  PRAGMA foreign_keys = ON;
  CREATE TABLE p1(x PRIMARY KEY);
  CREATE TABLE c1(y REFERENCES p1);

  INSERT INTO p1 VALUES(2);
  INSERT INTO p1 VALUES(4);
  INSERT INTO p1 VALUES(6);
}

do_execsql_test  16.1.2 { INSERT INTO c1 VALUES(2) }
do_catchsql_test 16.1.3 { 
  INSERT INTO c1 VALUES(3) 
} {1 {foreign key constraint failed}}
do_execsql_test 16.1.4 { SELECT * FROM c1 } {2}

#-------------------------------------------------------------------------
reset_db

do_execsql_test 17.1 {

  PRAGMA foreign_keys = ON;
  CREATE TABLE t1(x PRIMARY KEY);
  CREATE TABLE t2(a PRIMARY KEY, b);

  INSERT INTO t1 VALUES('X');

  INSERT INTO t2 VALUES(1, 'A');
  INSERT INTO t2 VALUES(2, 'B');
  INSERT INTO t2 VALUES(3, 'C');
  INSERT INTO t2 VALUES(4, 'D');
  INSERT INTO t2 VALUES(5, 'A');
}

do_catchsql_test 17.2 { 
  INSERT INTO t1 SELECT b FROM t2;
} {1 {column x is not unique}}

do_execsql_test 17.3 { SELECT * FROM t1 } {X}

#-------------------------------------------------------------------------
reset_db

do_execsql_test 18.1 {
  CREATE TABLE t1(a, b, c, UNIQUE(a,b) ON CONFLICT IGNORE);
  CREATE TABLE t2(x);

  INSERT INTO t1 VALUES(1,2,3);
  BEGIN;
    INSERT INTO t2 VALUES(1); 
    INSERT INTO t1 VALUES(1,2,4);
  COMMIT;
}

do_execsql_test 18.2 { SELECT * FROM t1 } {1 2 3}
do_execsql_test 18.3 { SELECT * FROM t2 } {1}

#-------------------------------------------------------------------------
reset_db

do_test 19.1 {
  catchsql {
    CREATE TABLE t4(x);
    CREATE UNIQUE INDEX t4x ON t4(x);
    BEGIN;
    INSERT INTO t4 VALUES(1);
    INSERT OR ROLLBACK INTO t4 VALUES(1);
  }
  execsql { SELECT * FROM t4 }
} {}

# Check the above closed the transaction.
do_execsql_test 19.2 { BEGIN }
do_execsql_test 19.3 { COMMIT }

#-------------------------------------------------------------------------
reset_db

do_execsql_test 20.1 {
  CREATE TABLE def(d, e, f);
  BEGIN;
  INSERT INTO def VALUES('a', 'b', 'c');

  INSERT INTO def SELECT * FROM def;
  INSERT INTO def SELECT * FROM def;
  INSERT INTO def SELECT * FROM def;
  INSERT INTO def SELECT * FROM def;
  INSERT INTO def SELECT * FROM def;

  SELECT count(*) FROM def;
} {32}

do_execsql_test 20.2 { ROLLBACK }
do_execsql_test 20.3 { SELECT count(*) FROM def } 0

#-------------------------------------------------------------------------
reset_db

do_execsql_test 21.1 {
  PRAGMA foreign_keys = on;
  CREATE TABLE t1(a PRIMARY KEY, b);
  CREATE TABLE t2(c REFERENCES t1(a), d);
}

do_execsql_test 21.2 {
  INSERT INTO t1 VALUES(1, 2);
  INSERT INTO t2 VALUES(1, 3);
  INSERT INTO t2 VALUES(NULL, 4);
}

do_catchsql_test 21.3 {
  UPDATE t2 SET c=2 WHERE d=4;
} {1 {foreign key constraint failed}}


#-------------------------------------------------------------------------
reset_db

do_execsql_test 22.1 {
  CREATE TABLE t1(x PRIMARY KEY);
  INSERT INTO t1 VALUES('abc');
}

do_execsql_test 22.2 { UPDATE t1 SET x = 'abc' }
do_execsql_test 22.3 { SELECT * FROM t1 } {abc}

#-------------------------------------------------------------------------
reset_db

do_execsql_test 23.1 {
  PRAGMA foreign_keys = on;
  CREATE TABLE t1(a PRIMARY KEY, b);
  CREATE TABLE t2(c REFERENCES t1(a), d);
}
proc out {} {
  set t1 [execsql {SELECT a FROM t1}]
  set t2 [execsql {SELECT c FROM t2}]
  puts "t1: $t1       t2: $t2"
}

do_test 23.2 {
  catchsql "BEGIN; INSERT INTO t2 VALUES(1, 3)" ; execsql COMMIT
} {}
do_test 23.3 {
  catchsql "BEGIN; INSERT INTO t1 VALUES(1, 2)" ; execsql COMMIT
} {}
do_test 23.4 {
  catchsql "BEGIN; INSERT INTO t2 VALUES(1, 3)" ; execsql COMMIT
} {}
do_test 23.5 {
  catchsql "BEGIN; INSERT INTO t2 VALUES(2, 4)" ; execsql COMMIT
} {}
do_test 23.6 {
  catchsql "BEGIN; INSERT INTO t2 VALUES(NULL, 4)" ; execsql COMMIT
} {}
do_test 23.7 {
  catchsql "BEGIN; UPDATE t2 SET c=2 WHERE d=4" ; execsql COMMIT
} {}
do_test 23.8 {
  catchsql "BEGIN; UPDATE t2 SET c=1 WHERE d=4" ; execsql COMMIT
} {}
do_test 23.9 {
  catchsql "BEGIN; UPDATE t2 SET c=1 WHERE d=4" ; execsql COMMIT
} {}
do_test 23.10 {
  catchsql "BEGIN; UPDATE t2 SET c=NULL WHERE d=4" ; execsql COMMIT
} {}
do_test 23.11 {
  execsql BEGIN
  catchsql "DELETE FROM t1 WHERE a=1"
  execsql COMMIT
} {}

do_catchsql_test 23.3 {
  BEGIN;
    UPDATE t1 SET a = 2;
  COMMIT;
} {1 {foreign key constraint failed}}

#-------------------------------------------------------------------------
reset_db

do_execsql_test 24.1 {
  CREATE TABLE p(x INTEGER);
  INSERT INTO p VALUES(35.0);
  SELECT typeof(x) FROM p;
} {integer}

do_execsql_test 24.2 {
  CREATE TABLE p2(x INTEGER PRIMARY KEY);
  INSERT INTO p2 VALUES(35.0);
  SELECT typeof(x) FROM p2;
} {integer}

#-------------------------------------------------------------------------
reset_db
do_execsql_test 25.1 {
  PRAGMA foreign_keys = on;
  CREATE TABLE p(x INT PRIMARY KEY);
  CREATE TABLE c(y REFERENCES p);
  INSERT INTO p VALUES(35);
PRAGMA vdbe_trace = 1;
  INSERT INTO c VALUES(35.0);
}
execsql { PRAGMA vdbe_trace = 0; }

explain {
  INSERT INTO c VALUES(35.0);
}
finish_test

#-------------------------------------------------------------------------
reset_db
do_execsql_test 26.1 {
  PRAGMA foreign_keys = on;
  CREATE TABLE p(x INT PRIMARY KEY);
  CREATE TABLE c(y REFERENCES p);
  INSERT INTO p VALUES(35.0);
  INSERT INTO c VALUES(35.0);
}

finish_test

#proc populate_t1 {} {
#  db eval {
#    INSERT INTO t1(a, b) VALUES(4, 'four');
#    INSERT INTO t1(a, b) VALUES(9, 'nine');
#    INSERT INTO t1(a, b) VALUES(5, 'five');
#    INSERT INTO t1(a, b) VALUES(1, 'one');
#    INSERT INTO t1(a, b) VALUES(7, 'seven');
#    INSERT INTO t1(a, b) VALUES(8, 'eight');
#    INSERT INTO t1(a, b) VALUES(2, 'two');
#    INSERT INTO t1(a, b) VALUES(3, 'three');
#    INSERT INTO t1(a, b) VALUES(6, 'six');
#    INSERT INTO t1(a, b) VALUES(10, 'ten');
#  }
#}
#
#foreach {t schema} {
#  1 "CREATE TABLE t1(a, b)"
#  2 "CREATE TABLE t1(a, b); CREATE INDEX i1 ON t1(a);"
#  3 "CREATE TABLE t1(a, b); CREATE INDEX i1 ON t1(b);"
#  4 "CREATE TABLE t1(a PRIMARY KEY, b)"
#} {
#
#  do_test 1.$t.0 {
#    reset_db
#    execsql $schema
#    populate_t1
#  } {}
#
#  foreach {u sql res} {
#    1 "SELECT * FROM t1 WHERE a = 7"        {7 seven}
#    2 "SELECT * FROM t1 WHERE b = 'seven'"  {7 seven}
#  } {
#    do_execsql_test 1.$t.$u $sql $res
#  }
#}

finish_test
